FID,Search_Center,tweet_id,tweet_datetime,tweet_keyword,text,user_name,user_id,to_user,to_user_id,in_reply_to_tweet_id,lang,location,geo,tweet_datetime_local,lng,lat,accuracy
54166,Chicago,277008879286640641,12/7/2012 11:17,Ford Escape,I uploaded a @YouTube video http://t.co/WJkORO7Y 2009 FORD ESCAPE Countryside IL,WestfieldFord1,349199467,,,,en,"Countryside, IL",,12/7/2012 5:17,-77.4176279,39.052361,4
54282,Los_Angeles,279384192058552320,12/14/2012 0:35,Ford Escape,"Visit the Ford Credit Escape Your Payments Event and you can play for your chance to instantly win a prize.
 http://t.co/VFleM2sA",meowingAtDmoon,40992389,,,,en,Downtown           Los Angeles,,12/13/2012 16:35,-118.2436849,34.0522342,4
54283,Los_Angeles,279278741325242368,12/13/2012 17:36,Ford Escape,I am thinking about getting a Ford Escape Hybrid for a new car!,matroidlayton,578160125,,,,en,Pasadena California,,12/13/2012 9:36,-118.1445155,34.1477849,4
54284,Los_Angeles,279268349207269376,12/13/2012 16:55,Ford Escape,Vouching it. Will make it to the park in our rental car (nice clean Ford Escape) before nap. http://t.co/tFPZLWMS,mamasmeals,16005510,,,,en,"Santa Monica, California",,12/13/2012 8:55,-118.4911912,34.0194543,4
54285,Los_Angeles,278638149561901058,12/11/2012 23:11,Ford Escape,".@Ford recalls Fusion and Escape with EcoBoost 1.6-liter, provides an explanation on how it would be fixed - http://t.co/twOyrrIz",CarsDirect,15393164,,,,en,"El Segundo, CA",,12/11/2012 15:11,-118.4164652,33.9191799,4
54286,Los_Angeles,278345627174326273,12/11/2012 3:49,Ford Escape,Packing our whole family and tons of gear in our little Ford escape is not the most comfortable experience... -Sydney,echosmith,132533271,,,,en,"Los Angeles, CA",,12/10/2012 19:49,-118.2436849,34.0522342,4
54287,Los_Angeles,278339468220563456,12/11/2012 3:24,Ford Escape,Fix for #Escape #Fusion fires and engine overheating @Ford http://t.co/9BX5x0Ln,LATimesJerry,18063381,,,,en,Los Angeles,,12/10/2012 19:24,-118.2436849,34.0522342,4
54288,Los_Angeles,278275439900901379,12/10/2012 23:10,Ford Escape,"RT @latimesbiz: Ford says it has fix for Escape, Fusion models with fire problem http://t.co/PImI27rU",dabigpish,399073246,,,,en,,,12/10/2012 15:10,-69.6691186,-38.8233843,2
54289,Los_Angeles,278262945048317953,12/10/2012 22:20,Ford Escape,"""Yes, here's your large, car-sized thick blanket"": 'Ford says it has fix for Escape, Fusion models with fire problem' http://t.co/PzJoWo5P",dilodilo,28418452,,,,en,"Los Angeles, CA",,12/10/2012 14:20,-118.2436849,34.0522342,4
54290,Los_Angeles,278259046522429440,12/10/2012 22:05,Ford Escape,"#Ford blames coolant system for #Escape, #Fusion engine fires http://t.co/as1VWuHl",SuperAutoRepair,72153559,,,,en,"Los Angeles, CA",,12/10/2012 14:05,-118.2436849,34.0522342,4
54291,Los_Angeles,278258175331954688,12/10/2012 22:01,Ford Escape,"Ford says it has fix for Escape, Fusion models with fire problem http://t.co/kI0cePDV",latimesmost,10221192,,,,en,"Los Angeles, CA",,12/10/2012 14:01,-118.2436849,34.0522342,4
54292,Los_Angeles,278257167902056448,12/10/2012 21:57,Ford Escape,"Ford says it has fix for Escape, Fusion models with fire problem http://t.co/JpHf2KGt",latimesfirehose,17919245,,,,en,"Los Angeles, CA",,12/10/2012 13:57,-118.2436849,34.0522342,4
54293,Los_Angeles,278256054234660864,12/10/2012 21:53,Ford Escape,"RT @latimesbiz: Ford says it has fix for Escape, Fusion models with fire problem http://t.co/PImI27rU",Donengene,16252960,,,,en,CA,,12/10/2012 13:53,-119.4179324,36.778261,2
54294,Los_Angeles,278255781302910977,12/10/2012 21:52,Ford Escape,"Ford says it has fix for Escape, Fusion models with fire problem: Ford said it has developed a fix that stops an... http://t.co/7z9Y8CMH",DowntownLADaily,605773565,,,,en,"Downtown Los Angeles, CA",,12/10/2012 13:52,-118.2436849,34.0522342,4
54295,Los_Angeles,278255484195176448,12/10/2012 21:50,Ford Escape,"RT @latimesbiz: Ford says it has fix for Escape, Fusion models with fire problem http://t.co/PImI27rU",flipboardbiz,424027679,,,,en,"Palo Alto, CA",,12/10/2012 13:50,-98.6659426,20.2861441,6
54296,Los_Angeles,278253893111136256,12/10/2012 21:44,Ford Escape,"Ford says it has fix for Escape, Fusion models with fire problem http://t.co/PImI27rU",latimesbiz,10221272,,,,en,"Los Angeles, CA",,12/10/2012 13:44,-118.2436849,34.0522342,4
54297,Los_Angeles,278242866231390208,12/10/2012 21:00,Ford Escape,"Ford says it has fix for Escape, Fusion models with fire problem  http://t.co/otshB9nn",LAThevenot,76761966,,,,en,Los Angeles,,12/10/2012 13:00,-118.2436849,34.0522342,4
54298,Los_Angeles,278241073992704000,12/10/2012 20:53,Ford Escape,.@Ford develops fix for #Escape #Fusion fires and engine overheating http://t.co/9BX5x0Ln,LATimesJerry,18063381,,,,en,Los Angeles,,12/10/2012 12:53,-118.2436849,34.0522342,4
54299,Los_Angeles,278240140072210432,12/10/2012 20:49,Ford Escape,"Ford finds software fix for engine fire problems: Ten days after announcing the recall of nearly 90,000 Escape c... http://t.co/WKu3w9qH",lacarsrepo,30121979,,,,en,19701 Sherman Way,,12/10/2012 12:49,0,0,0
54300,Los_Angeles,278238934205607937,12/10/2012 20:45,Ford Escape,"Ford finds software fix for engine fire problems: Ten days after announcing the recall of nearly 90,000 Escape c... http://t.co/ZLITCM2y",AdAgencyNews,114654960,,,,en,"Pasadena, CA",,12/10/2012 12:45,-118.1445155,34.1477849,4
54301,Los_Angeles,278235379373576192,12/10/2012 20:30,Ford Escape,"Ford Says It has Fix for Recalled 2013 Escape, Fusion Vehicles: Ford Motor Co. said it has come up w... http://t.co/6KKHNpuD by WSJ Auto",CAAagency,272120738,,,,en,Los Angeles,,12/10/2012 12:30,-118.2436849,34.0522342,4
54302,Los_Angeles,278202654419738624,12/10/2012 18:20,Ford Escape,Ford has problems with their Escape model. Is it really called Escape?,neurius,786532633,,,,en,"Los Angeles, CA",,12/10/2012 10:20,-118.2436849,34.0522342,4
54303,Los_Angeles,278201984287399937,12/10/2012 18:18,Ford Escape,"Ford blames coolant system for Escape, Fusion fires: The automaker announces a fix to start next week that should end the problem",PrimeBlogReview,774630193,,,,en,"Santa Monica, CA",,12/10/2012 10:18,-118.4911912,34.0194543,4
54304,Los_Angeles,278201980311191552,12/10/2012 18:18,Ford Escape,"Ford blames coolant system for Escape, Fusion fires: The automaker announces a fix to start next week that shoul... http://t.co/MztsKhqW",AdAgencyNews,114654960,,,,en,"Pasadena, CA",,12/10/2012 10:18,-118.1445155,34.1477849,4
54305,Los_Angeles,278201283561811971,12/10/2012 18:15,Ford Escape,Ford finds a fix for the recalled 1.6-liter EcoBoost engine that could catch on fire in Escape and Fusion: http://t.co/fChEHmMS,ChrisWoodyard,28351096,,,,en,Los Angeles,,12/10/2012 10:15,-118.2436849,34.0522342,4
54306,Los_Angeles,278169645532475392,12/10/2012 16:09,Ford Escape,I just entered Escape with the #Amazing Race for my chance to win the all new 2013 Ford Escape! http://t.co/1J2QqdQX,sonicerjoel,70999033,,,,en,"San Gabriel, CA 91775",,12/10/2012 8:09,-118.1058333,34.0961111,4
54307,Los_Angeles,278033162729299968,12/10/2012 7:07,Ford Escape,I just entered Escape with the #Amazing Race for my chance to win the all new 2013 Ford Escape! http://t.co/5UbRcupW,vikinglawyer,43608857,,,,en,"??T: 34.105409,-118.242055",,12/9/2012 23:07,15.2223006,49.4156776,6
54308,Los_Angeles,277997460905943040,12/10/2012 4:45,Ford Escape,Oh man. Real subtle #AmazingRace partnership. Contestants had to use the hands-free-lift gate to load cargo into their @Ford escape.,jasonpickar,37714790,,,,en,Los Angeles,,12/9/2012 20:45,-118.2436849,34.0522342,4
54309,Los_Angeles,277837980310319107,12/9/2012 18:11,Ford Escape,"#Condoofdespair 1:
There was no need to wonder why my 2010 Ford Escape was engulfed in flames in the carport.",adverbmoran,24034218,,,,en,"Los Angeles, CA",,12/9/2012 10:11,-118.2436849,34.0522342,4
54310,Los_Angeles,277165007408619520,12/7/2012 21:37,Ford Escape,@crystalllx33 Trust me. I feel you. I asked money bags to buy me the new Ford Escape today... #fail,natrowz,548041099,crystalllx33,298007839,277160648025178112,en,Los Angeles,,12/7/2012 13:37,-118.2436849,34.0522342,4
54311,Los_Angeles,277101482095022080,12/7/2012 17:25,Ford Escape,Ford Motor Co. Issues Recall of Escape &amp Fusion Vehicles Due to Overheating Problems That Can cause Engine Fires http://t.co/BlGHq2p9 #Ford,YSYLAW,487191558,,,,en,Los Angeles,,12/7/2012 9:25,-118.2436849,34.0522342,4
54312,Los_Angeles,276935810262118400,12/7/2012 6:26,Ford Escape,New Ford Escape video on the blog! http://t.co/XCPKW36w http://t.co/SNtP1ntJ,LaurenMessiah,7788922,,,,en,"Los Angeles, CA",,12/6/2012 22:26,-118.2436849,34.0522342,4
54467,San_Francisco,278643536633659393,12/11/2012 23:32,Ford Escape,Ford Escape Manual Replacement Driver and Passenger Side Mirror: This is a Driver and Passenger side high qualit... http://t.co/QHvVG97T,pyjemywow,361229216,,,,en,"San Francisco, CA",,12/11/2012 15:32,-122.4194155,37.7749295,4
54468,San_Francisco,278605318571819008,12/11/2012 21:00,Ford Escape,"#Ford blames software glitch for Fusion, Escape recall. http://t.co/PsaSuLN4 #carsafety",shattuckauto,242952996,,,,en,"Berkeley, CA",,12/11/2012 13:00,-122.272747,37.8715926,4
54469,San_Francisco,278605206399377408,12/11/2012 21:00,Ford Escape,"#Ford blames software glitch for Fusion, Escape recall. http://t.co/OTyZLhHt #carsafety",shattuckauto,242952996,,,,en,"Berkeley, CA",,12/11/2012 13:00,-122.272747,37.8715926,4
54470,San_Francisco,278517214469029890,12/11/2012 15:10,Ford Escape,"Ford Has An Escape Engine Fix, Maserati Plans More Models, And The 2014 Chevy Silverado Is Coming http://t.co/FOmtO3mz",RawSignalAutos,229556620,,,,en,San Francisco,,12/11/2012 7:10,-122.4194155,37.7749295,4
54471,San_Francisco,278502318985588736,12/11/2012 14:11,Ford Escape,Official: Ford details how it will fix recalled fire-risk 2013 Escape and Fusion models http://t.co/zoY1YQGz,RawSignalAutos,229556620,,,,en,San Francisco,,12/11/2012 6:11,-122.4194155,37.7749295,4
54472,San_Francisco,278384460901265408,12/11/2012 6:23,Ford Escape,"Now this is how you 'update' a car! With software, of course. Go #Ford. #furtherwithFord http://t.co/aWIpmkOr",chuongvision,14398551,,,,en,"San Francisco, California",,12/10/2012 22:23,-122.4194155,37.7749295,4
54473,San_Francisco,278370685741568001,12/11/2012 5:28,Ford Escape,disgusting.. i try to read a dailymail article about Jenni Rivera's death and i get a bouncy Ford Escape video in the bground.. so so classy,PiaWindrider,519742605,,,,en,"San Francisco, CA",,12/10/2012 21:28,-122.4194155,37.7749295,4
54474,San_Francisco,278357226647875584,12/11/2012 4:35,Ford Escape,(http://t.co/KsL5Ewt5) - Ford to correct Fusion and Escape overheating issue with softwa... @ Some IT - Social Media Information Technology,someitweb,118784297,,,,en,"San Francisco, CA",,12/10/2012 20:35,-122.4194155,37.7749295,4
54475,San_Francisco,278271891674910721,12/10/2012 22:56,Ford Escape,Ford says software update will fix fire problem: Ford will update software on 2013 Escape SUVs and Fusion cars to... http://t.co/QuZcOGm4,SanFranciscoCP,60452453,,,,en,,"37.786783, -122.414876",12/10/2012 14:56,-69.6691186,-38.8233843,2
54476,San_Francisco,278240840516771841,12/10/2012 20:52,Ford Escape,"Ford Says Software Glitch to Blame in Fusion, Escape Recall: http://t.co/qsh7hFJl",katchomama,32519952,,,,en,San Francisco,,12/10/2012 12:52,-122.4194155,37.7749295,4
54477,San_Francisco,278207730580340736,12/10/2012 18:41,Ford Escape,"Ford blames coolant system for Escape, Fusion fires http://t.co/Z8OrNpgK",moneymikemason,489098184,,,,en,San Francisco,,12/10/2012 10:41,-122.4194155,37.7749295,4
54531,Philadelphia,278989191319285760,12/12/2012 22:26,Ford Escape,"Yeah, your Ford Escape is SO luxurious! http://t.co/ZfuhbzWh",BaconEggnChase,40898534,,,,en,Philly,,12/12/2012 17:26,-75.163789,39.952335,4
54532,Philadelphia,278903108959084545,12/12/2012 16:44,Ford Escape,"@c0gnacwest I want my baby back to blast through this snow. I'm driving a Ford Escape right now. Not terrible, but it's not the same.",4wrestling,28468919,c0gnacwest,24841180,278902431050502144,en,"Pennsylvania, Philadelphia",,12/12/2012 11:44,-77.1945247,41.2033216,2
54533,Philadelphia,278857947164053504,12/12/2012 13:44,Ford Escape,Ford Escape Escape from Zombies This is from Patrick Boivin who did another fantastic zombie short on YouTube http://t.co/8FKhizRz,1Chenzo,84066474,,,,en,"Philadelphia, PA",,12/12/2012 8:44,-75.163789,39.952335,4
54534,Philadelphia,278639825794502656,12/11/2012 23:18,Ford Escape,@FordService @Bethenny and my husband has a 08 ford 150 crew cab! I'm currently trying to save for a 13 escape!! I love love mine so much!,vik1213,28550572,FordService,16512432,278562444991926273,en,,"40.027065, -75.054405",12/11/2012 18:18,-69.6691186,-38.8233843,2
54535,Philadelphia,278639466908901376,12/11/2012 23:16,Ford Escape,"@FordService @Bethenny I have a 2005 ford.escape, my parents have had 00,03,05 explorer, an 07 edge, and currently in a 12 escape. Love ford",vik1213,28550572,FordService,16512432,278562444991926273,en,,"40.027012, -75.054448",12/11/2012 18:16,-69.6691186,-38.8233843,2
54536,Philadelphia,278538512633049088,12/11/2012 16:35,Ford Escape,"Check out the new 2013 Ford Escape Reinvented
http://t.co/vnrKIqnc #ad",KeyannaRochelle,18686148,,,,en,Philly x Worldwide ??????,,12/11/2012 11:35,-75.0503159,40.0323461,9
54537,Philadelphia,278231312899395584,12/10/2012 20:14,Ford Escape,"News: #Ford Says It has Fix for Recalled 2013 Escape, Fusion Vehicles  http://t.co/iEma1I0O  ...from @WSJ  #fleet #safety #recall",ARIfleet,41372445,,,,en,"Mount Laurel, NJ",,12/10/2012 15:14,-74.9002778,39.9488889,4
54538,Philadelphia,278224619792633858,12/10/2012 19:48,Ford Escape,"Ford blames software glitch for Fusion, Escape recall: DETROIT (Reuters) - A defect that raised the risk of an e... http://t.co/xwEZo48z",GrammyBoyENT,532734677,,,,en,Philadelphia Area,,12/10/2012 14:48,-75.163789,39.952335,4
54539,Philadelphia,278221322381848577,12/10/2012 19:35,Ford Escape,"RT @CarDealerGuy: #Cars #Automotive Ford blames software glitch for Fusion, Escape recall: A defect that rais... http://t.co/BdBdnifV http://t.co/EP6XGVMN",CSMC_Cars,782223769,,,,en,"Doha, Qatar",,12/10/2012 14:35,51.522476,25.280282,4
54540,Philadelphia,278220913802088448,12/10/2012 19:33,Ford Escape,"#Cars #Automotive Ford blames software glitch for Fusion, Escape recall: A defect that rais... http://t.co/BdBdnifV http://t.co/EP6XGVMN",CarDealerGuy,112908576,,,,en,Philly,,12/10/2012 14:33,-75.163789,39.952335,4
54541,Philadelphia,277890404261707776,12/9/2012 21:40,Ford Escape,"Check out the new 2013 Ford Escape Reinvented
http://t.co/vnrKIqnc #ad .",KeyannaRochelle,18686148,,,,en,Philly x Worldwide ??????,,12/9/2012 16:40,-75.0503159,40.0323461,9
54542,Philadelphia,277838106722435072,12/9/2012 18:12,Ford Escape,@Bethenny I have a ford escape and love it...my parents always have an explorer and love them.,vik1213,28550572,Bethenny,12701412,277815225732980737,en,,"40.027022, -75.054414",12/9/2012 13:12,-69.6691186,-38.8233843,2
54543,Philadelphia,277767106043465729,12/9/2012 13:30,Ford Escape,"Check out the new 2013 Ford Escape Reinvented:
http://t.co/vnrKIqnc #ad",KeyannaRochelle,18686148,,,,en,Philly x Worldwide ??????,,12/9/2012 8:30,-75.0503159,40.0323461,9
54544,Philadelphia,277148346098003970,12/7/2012 20:31,Ford Escape,RT @OxfordValleyPA: Santa delivered this 2012 Ford Escape courtesy of McCafferty Ford to the mall. Anybody want to test drive it? Let... http://t.co/uL2iilvU,IrenasCleaning,706138885,,,,en,"Lawrenceville, NJ 08648",,12/7/2012 15:31,-83.9879625,33.9562149,4
54545,Philadelphia,277077746100871170,12/7/2012 15:50,Ford Escape,@1800lemonlaw Could 2013 Ford Recall Lead To A Lemon Law Claim For Your Escape or Fusion?: It appears Santa shou... http://t.co/Ii6ootx2,1800lemonlaw,18049930,1800lemonlaw,18049930,,en,"Ambler, PA",,12/7/2012 10:50,-75.2215651,40.1545535,4
54546,Philadelphia,277077744335073280,12/7/2012 15:50,Ford Escape,Could 2013 Ford Recall Lead To A Lemon Law Claim For Your Escape or Fusion?: It appears Santa should be putting ... http://t.co/7mfbxY1r,1800lemonlaw,18049930,,,,en,"Ambler, PA",,12/7/2012 10:50,-75.2215651,40.1545535,4
54547,Philadelphia,277064702750756865,12/7/2012 14:59,Ford Escape,Santa delivered this 2012 Ford Escape courtesy of McCafferty Ford to the mall. Anybody want to test drive it? Let... http://t.co/uL2iilvU,OxfordValleyPA,46406112,,,,en,"Langhorne, PA",,12/7/2012 9:59,-74.9226665,40.1745538,4
54602,Phoenix,279416348856180736,12/14/2012 2:43,Ford Escape,A free Ford Escape includes an unexpected person in new mini series http://t.co/2sSica6Y via @hypable,lukenbachr,29067876,,,,en,"mesa, arizona",,12/13/2012 18:43,-111.8314724,33.4151843,4
54603,Phoenix,278255683470782465,12/10/2012 21:51,Ford Escape,"Ford blames coolant system for Escape, Fusion engine fires. http://t.co/6XWVOXxo",GinaMaravillaTV,78709964,,,,en,"Phoenix, Arizona ",,12/10/2012 13:51,-112.0740373,33.4483771,4
54604,Phoenix,278220906877296640,12/10/2012 19:33,Ford Escape,"Ford blames software glitch for Fusion, Escape recall: A defect that raised the risk of an engine fire in Ford's... http://t.co/x1vzCB39",microsites,17420291,,,,en,"Phoenix, Arizona",,12/10/2012 11:33,-112.0740373,33.4483771,4
54605,Phoenix,278219646166003712,12/10/2012 19:28,Ford Escape,"Why is it so often fire with Ford (Pinto, Econoline, Crown Vic, Escape)? http://t.co/eGzk6hYD",TireKicker,28227699,,,,en,"Phoenix, AZ",,12/10/2012 11:28,-112.0740373,33.4483771,4
54606,Phoenix,278199288801153024,12/10/2012 18:07,Ford Escape,RT @ABC15Desk: (AP) -- Ford will update software on 2013 Escape SUVs and Fusion cars to fix a coolant problem that can cause fires.,ZacharLaw,100010307,,,,en,"Phoenix, AZ",,12/10/2012 10:07,-112.0740373,33.4483771,4
54607,Phoenix,278199239627137024,12/10/2012 18:07,Ford Escape,(AP) -- Ford will update software on 2013 Escape SUVs and Fusion cars to fix a coolant problem that can cause fires.,ABC15Desk,17837341,,,,en,"Phoenix, Arizona",,12/10/2012 10:07,-112.0740373,33.4483771,4
54608,Phoenix,277911049351598080,12/9/2012 23:02,Ford Escape,I just entered Escape with the #Amazing Race for my chance to win the all new 2013 Ford Escape! http://t.co/NEZDMRKd,bigsoftiemom,510578356,,,,en,Phoenix AZ,,12/9/2012 15:02,-112.0740373,33.4483771,4
54626,San_Diego,279360724151701504,12/13/2012 23:02,Ford Escape,Flawed cooling system design believed to be source of 12 vehicle fires to date http://t.co/hbuBphHD,CleanEnergyPrin,242884495,,,,en,San Diego,,12/13/2012 15:02,-99.821927,20.6886441,6
54627,San_Diego,278715338680573952,12/12/2012 4:18,Ford Escape,"Ford finds fix for fire risk in Fusion, Escape models",soulsilenr,481015622,,,,en,San Diego,,12/11/2012 20:18,-99.821927,20.6886441,6
54628,San_Diego,278269925230002176,12/10/2012 22:48,Ford Escape,"RT via http://t.co/Z5N4PliC News Summary: Ford Escape, Fusion recall http://t.co/BRrBjHsL #SanDiego",GreenesTweets,187452381,,,,en,"San Diego, CA",,12/10/2012 14:48,-99.821927,20.6886441,6
54680,Dallas,279404413175623680,12/14/2012 1:56,Ford Escape,RT @kimorlando: RT @SheBuysCars: Take a peek inside the new @Ford Escape and a look at its fun technology  http://t.co/UHZlVgMv #TMOM,CarmelLeeMooney,537327467,,,278921381121519617,en,Sierra Foothills,,12/13/2012 19:56,-111.987781,33.324043,9
54681,Dallas,279394025151266818,12/14/2012 1:15,Ford Escape,RT @SheBuysCars: Take a peek inside the new @Ford Escape and a look at its fun technology  http://t.co/UHZlVgMv #TMOM,kimorlando,15566503,SheBuysCars,627552647,278921381121519617,en,Northeast,,12/13/2012 19:15,27.4556388,-20.9030555,2
54682,Dallas,279027622212681728,12/13/2012 0:59,Ford Escape,RT @Dani_West12: That's okay Jocelyn the ford escape was ugly anyways. #wheeloffortune,xoskylarann,409955862,,,,en,"cowtown, tx",,12/12/2012 18:59,-111.8616807,32.9409965,6
54683,Dallas,279026868164907008,12/13/2012 0:56,Ford Escape,That's okay Jocelyn the ford escape was ugly anyways. #wheeloffortune,Dani_West12,528581983,,,,en,"Dallas, Tx",,12/12/2012 18:56,-96.8004511,32.7801399,4
54684,Dallas,278568579396415489,12/11/2012 18:34,Ford Escape,"Official: Ford details how it will fix recalled fire-risk 2013 Escape and Fusion models: Filed under: Sedan, Gov... http://t.co/ISTShdSd",wwCannonTX,224679747,,,,en,"Dallas, TX",,12/11/2012 12:34,-96.8004511,32.7801399,4
54685,Dallas,278523520777060353,12/11/2012 15:35,Ford Escape,"Ford blames software glitch for Fusion, Escape recall http://t.co/rapElPg6 $F #Cars",CraigsCollision,118580140,,,,en,"Grapevine, TX 76051",,12/11/2012 9:35,-97.0780654,32.9342919,4
54686,Dallas,278512718225489921,12/11/2012 14:53,Ford Escape,"gotta know the scoop Ford Escape, Fusion get software fix: Update will prevent fire in 1.6-liter EcoBoost engine... http://t.co/CmhsJlBM",PatCarSavings,41496818,,,,en,Dallas,,12/11/2012 8:53,-96.8004511,32.7801399,4
54687,Dallas,278487302672633856,12/11/2012 13:12,Ford Escape,Ford details how it will fix recalled fire-risk 2013 Escape and Fusion models http://t.co/mRK4as0X,DPete4,44064925,,,,en,DFW Texas,,12/11/2012 7:12,-97.0406533,32.8974493,9
54688,Dallas,278485139334516736,12/11/2012 13:03,Ford Escape,"Official: Ford details how it will fix recalled fire-risk 2013 Escape and Fusion models: Filed under: Sedan, Gov... http://t.co/8TdMz2fw",OpenRoadLending,110522630,,,,en,"Irving, TX",,12/11/2012 7:03,-96.9488945,32.8140177,4
54689,Dallas,278293973951455233,12/11/2012 0:23,Ford Escape,"Ford Announces Fix for Fire Risk in 2013 Ford Escape, Fusion:  http://t.co/bhoEv9D4",OpenRoadLending,110522630,,,,en,"Irving, TX",,12/10/2012 18:23,-96.9488945,32.8140177,4
54690,Dallas,278268241577656321,12/10/2012 22:41,Ford Escape,"Ford says it has fix for Escape, Fusion models with fire problem  Los Angeles Times http://t.co/QoZMyA3d",JohnHortoney,420015637,,,,en,"Dallas,Texas",,12/10/2012 16:41,-96.8004511,32.7801399,4
54691,Dallas,278261746647584768,12/10/2012 22:15,Ford Escape,"Ford says it has software fix for Escape, Fusion engine fire issues: Ford Motor Co. said it will fix nearly 90,0... http://t.co/h4ulPWH6",DPete4,44064925,,,,en,DFW Texas,,12/10/2012 16:15,-97.0406533,32.8974493,9
54692,Dallas,278211238712975360,12/10/2012 18:55,Ford Escape,"Fix coming for 2013 Ford Escape, Fusion models with fire risk: Ford has announced that a corrective action has b... http://t.co/fQPRObRy",OpenRoadLending,110522630,,,,en,"Irving, TX",,12/10/2012 12:55,-96.9488945,32.8140177,4
54693,Dallas,277958883522265088,12/10/2012 2:12,Ford Escape,Enough with the Ford Escape product placement #amazingrace #annoying,saultrain,76634228,,,,en,,"32.629539, -96.913945",12/9/2012 20:12,-69.6691186,-38.8233843,2
54694,Dallas,277957434805460992,12/10/2012 2:06,Ford Escape,#AmazingRace #Must #Buy #Ford #Escape #Now,kayjay5868,364394270,,,,en,Northeast USA,,12/9/2012 20:06,-99.9018131,41.4925374,2
54695,Dallas,277954947595767808,12/10/2012 1:56,Ford Escape,The new ford escape is awesome. I want one! #AmazingRace,iiiirrriis,48974553,,,,en,"Dallas, TX",,12/9/2012 19:56,-96.8004511,32.7801399,4
54696,Dallas,277945380652597248,12/10/2012 1:18,Ford Escape,"Loving this product placement action on the #AmazingRace ... I see you, Ford Escape!",JustinTSamuel,23624264,,,,en,"DFW, TX",,12/9/2012 19:18,-97.0406533,32.8974493,9
54697,Dallas,277455287198289920,12/8/2012 16:51,Ford Escape,gotta know the scoop Autoweek in review: On Monday we woke to a recall involving the Ford Fusion and the Escape ... http://t.co/q0ZSXVhK,PatCarSavings,41496818,,,,en,Dallas,,12/8/2012 10:51,-96.8004511,32.7801399,4
54756,Houston,279316643237208064,12/13/2012 20:07,Ford Escape,2013 Ford F-150 Truck Lease Specials Fresno TX | 2012 Ford Escape Financ...: http://t.co/2daDe9G9 via @youtube,VLAutoMarketing,143977199,,,,en,"Houston,Tx",,12/13/2012 14:07,-95.3693896,29.7601927,4
54757,Houston,279316631468007424,12/13/2012 20:07,Ford Escape,I liked a @YouTube video from @legacyfordtx http://t.co/sSzhZxHh 2013 Ford F-150 Truck Lease Specials Fresno TX | 2012 Ford Escape,VLAutoMarketing,143977199,,,,en,"Houston,Tx",,12/13/2012 14:07,-95.3693896,29.7601927,4
54758,Houston,279288380859244544,12/13/2012 18:15,Ford Escape,"RECALL: Engine fire risk prompts 89,000 vehicle Ford Escape, Fusion recalls
 http://t.co/gn31dIZk",DMLeaseHouston,320790811,,,,en,"Houston, Texas",,12/13/2012 12:15,-95.3693896,29.7601927,4
54759,Houston,279183091950579712,12/13/2012 11:16,Ford Escape,RT @ooyyonetwork: Pacific Rim Do you need used #Ford Escape. We got it! http://t.co/bG9H1lPm. #Bethune #SC #cars,CSMC_Cars,782223769,,,,en,"Doha, Qatar",,12/13/2012 5:16,51.522476,25.280282,4
54760,Houston,279181397237837824,12/13/2012 11:10,Ford Escape,Pacific Rim Do you need used #Ford Escape. We got it! http://t.co/bG9H1lPm. #Bethune #SC #cars,ooyyonetwork,60863148,,,,en,Worldwide,,12/13/2012 5:10,-84.7227071,39.0841968,6
54761,Houston,278874522675974144,12/12/2012 14:50,Ford Escape,"2007 Ford Escape Hagerstown, MD Ford Dealership http://t.co/dMtk4gyI",VLAutoMarketing,143977199,,,,en,"Houston,Tx",,12/12/2012 8:50,-95.3693896,29.7601927,4
54762,Houston,278670338391416832,12/12/2012 1:19,Ford Escape,"RT @MaseratiNews: Ford Has An Escape Engine Fix, Maserati Plans More Models, And The 2014 .... http://t.co/cpWHz40q",Azim_HM,421230887,,,,en,Brunei Darussalam,,12/11/2012 19:19,114.727669,4.535277,1
54763,Houston,278669526244143106,12/12/2012 1:16,Ford Escape,"Ford Has An Escape Engine Fix, Maserati Plans More Models, And The 2014 .... http://t.co/cpWHz40q",MaseratiNews,272994428,,,,en,Worldwide,,12/11/2012 19:16,-84.7227071,39.0841968,6
54764,Houston,278568581061545984,12/11/2012 18:34,Ford Escape,#Auto | Official: Ford details how it will fix recalled fire-risk 2013 Escape and Fusion mo... http://t.co/4F9PzsHe via @therealautoblog,AutoCarHire,311924778,,,,en,Worldwide,,12/11/2012 12:34,-84.7227071,39.0841968,6
