FID,Search_Center,tweet_id,tweet_datetime,tweet_keyword,text,user_name,user_id,to_user,to_user_id,in_reply_to_tweet_id,lang,location,geo,tweet_datetime_local,lng,lat,accuracy
8391,Philadelphia,276360275073048576,12/5/2012 16:19,Ford Fusion,I entered the Fusion Street Chic sweeps to win a 2013 Ford Fusion. See if it fits your style: http://t.co/6yilQGhg,SoItookTheBus,20020772,,,,en,philly,,12/5/2012 11:19,-75.163789,39.952335,4
8392,Philadelphia,276359276933550080,12/5/2012 16:16,Ford Fusion,First thought when looking at the new Ford Fusion- It's a sorry attempt to cheaply replicate an Aston Martin...,PeterMegoulas,376506115,,,,en,"Philadelphia, PA",,12/5/2012 11:16,-75.163789,39.952335,4
8393,Philadelphia,276084057488629760,12/4/2012 22:02,Ford Fusion,Fusion Badge #FordSocial http://t.co/wMzn8j1o,geoffmatt17,114585391,,,,en,"Philadelphia, PA",,12/4/2012 17:02,-75.163789,39.952335,4
8394,Philadelphia,275986598858993665,12/4/2012 15:35,Ford Fusion,News: Ford Recalls 2013 SE and SEL Models of the Fusion and Escape with 1.6L Engines  http://t.co/hCbOl1jy  #fleet #recall #safety,ARIfleet,41372445,,,,en,"Mount Laurel, NJ",,12/4/2012 10:35,-74.9002778,39.9488889,4
8395,Philadelphia,275926099354071040,12/4/2012 11:34,Ford Fusion,I entered the Fusion Street Chic sweeps to win a 2013 Ford Fusion. See if it fits your style: http://t.co/5r0x0z6E,evie197580,181266452,,,,en,"philadelphia,pa",,12/4/2012 6:34,-75.163789,39.952335,4
8767,Phoenix,278505591436099585,12/11/2012 14:24,Ford Fusion,Ford Teams Up With BASF To Cut Emissions From Ford Fusion Production http://t.co/AgMhxSRZ,SaleWiki,17402624,,,,en,"Phoenix, AZ",,12/11/2012 6:24,-112.0740373,33.4483771,4
8768,Phoenix,278466053561020416,12/11/2012 11:47,Ford Fusion,I entered the Fusion Street Chic sweeps to win a 2013 Ford Fusion. See if it fits your style: http://t.co/DcgezbSv,AZKarMa,178532943,,,,en,"Scottsdale, AZ",,12/11/2012 3:47,-111.9260519,33.4941704,4
8769,Phoenix,278255683470782465,12/10/2012 21:51,Ford Fusion,"Ford blames coolant system for Escape, Fusion engine fires. http://t.co/6XWVOXxo",GinaMaravillaTV,78709964,,,,en,"Phoenix, Arizona ",,12/10/2012 13:51,-112.0740373,33.4483771,4
8770,Phoenix,278220906877296640,12/10/2012 19:33,Ford Fusion,"Ford blames software glitch for Fusion, Escape recall: A defect that raised the risk of an engine fire in Ford's... http://t.co/x1vzCB39",microsites,17420291,,,,en,"Phoenix, Arizona",,12/10/2012 11:33,-112.0740373,33.4483771,4
8771,Phoenix,278199288801153024,12/10/2012 18:07,Ford Fusion,RT @ABC15Desk: (AP) -- Ford will update software on 2013 Escape SUVs and Fusion cars to fix a coolant problem that can cause fires.,ZacharLaw,100010307,,,,en,"Phoenix, AZ",,12/10/2012 10:07,-112.0740373,33.4483771,4
8772,Phoenix,278199239627137024,12/10/2012 18:07,Ford Fusion,(AP) -- Ford will update software on 2013 Escape SUVs and Fusion cars to fix a coolant problem that can cause fires.,ABC15Desk,17837341,,,,en,"Phoenix, Arizona",,12/10/2012 10:07,-112.0740373,33.4483771,4
8773,Phoenix,277846377776685057,12/9/2012 18:45,Ford Fusion,"Ford Fusion, C-Max hybrid mileage claims to be reviewed by EPA http://t.co/l62oA9SN #in",microsites,17420291,,,,en,"Phoenix, Arizona",,12/9/2012 10:45,-112.0740373,33.4483771,4
8774,Phoenix,277843463318421506,12/9/2012 18:33,Ford Fusion,"Ford Fusion, C-Max hybrid mileage claims to be reviewed by EPA: The federal Environmental Protection Agency says... http://t.co/lbd717uD",microsites,17420291,,,,en,"Phoenix, Arizona",,12/9/2012 10:33,-112.0740373,33.4483771,4
8775,Phoenix,277722052180463616,12/9/2012 10:31,Ford Fusion,Ford Recall of Certain Model Year 2013 Fusion Vehicles,billymij,482514118,,,,en,Mesa,,12/9/2012 2:31,-111.8314724,33.4151843,4
8776,Phoenix,277073922615296000,12/7/2012 15:35,Ford Fusion,"Ford recalls 2013 Fusion in U.S. again: Ford is recalling 19,106 2013 Fusion sedans in the United States to repl... http://t.co/688N8ni0",microsites,17420291,,,,en,"Phoenix, Arizona",,12/7/2012 7:35,-112.0740373,33.4483771,4
8777,Phoenix,276900095188955136,12/7/2012 4:05,Ford Fusion,@redneckCTD. Has problems w/ this pic 1 I'm in a ford fusion * 2 I'm airborne * 3. blue in the pic is sky not water :-X http://t.co/mQGxeAkh,varien2012,165309942,redneckCTD,989824166,,en,"Phoenix, Arizona",,12/6/2012 20:05,-112.0740373,33.4483771,4
8778,Phoenix,276857573200773120,12/7/2012 1:16,Ford Fusion,Check out: Ford Fusion wins 2013 Green Car Of The Year http://t.co/mIbjnmei via @therealautoblog,theKatiePages,193139590,,,,en,Phoenix,,12/6/2012 17:16,-112.0740373,33.4483771,4
8779,Phoenix,276790569378906113,12/6/2012 20:49,Ford Fusion,"Ford C-Max, Fusion hybrids fall short of mpg claims, Consumer Reports says: Ford's C-Max and Fusion hybrids fall... http://t.co/NM6dxaL3",microsites,17420291,,,,en,"Phoenix, Arizona",,12/6/2012 12:49,-112.0740373,33.4483771,4
8780,Phoenix,276513803166965761,12/6/2012 2:30,Ford Fusion,"I saw a Ford Fusion today on the street, and was astonished to discover that the 2013 NASCAR version actually looks very similar to it.",TonyJWriter,89002214,,,,en,"Peoria, AZ",,12/5/2012 18:30,-89.5889864,40.6936488,4
8781,Phoenix,276410856709963776,12/5/2012 19:40,Ford Fusion,"Ford recalls 88,000 Escape and Fusion vehicles due to overheating problems that can cause engine fires.
http://t.co/4LoC5KqT",mnogborne,893908892,,,,en,"Phoenix, Arizona",,12/5/2012 11:40,-112.0740373,33.4483771,4
8782,Phoenix,276071513101332480,12/4/2012 21:12,Ford Fusion,@ScottMonty Just saw video awesome! Ford great vision/fusion brilliant!!,GregoryPlein,867454046,ScottMonty,1035491,276070612705873920,en,Phoenix Arizona,,12/4/2012 13:12,-112.0740373,33.4483771,4
8783,Phoenix,276013890545012736,12/4/2012 17:23,Ford Fusion,"Recall a big blow to Escape, Fusion http://t.co/tEW2Sp0M, via @USATODAY",tjtimmurphy,475084003,,,,en,"Phoenix
",,12/4/2012 9:23,-112.0740373,33.4483771,4
9122,San_Diego,278269925230002176,12/10/2012 22:48,Ford Fusion,"RT via http://t.co/Z5N4PliC News Summary: Ford Escape, Fusion recall http://t.co/BRrBjHsL #SanDiego",GreenesTweets,187452381,,,,en,"San Diego, CA",,12/10/2012 14:48,-99.821927,20.6886441,6
9123,San_Diego,278166540992536578,12/10/2012 15:57,Ford Fusion,"No chance of this w/ Volt. Rated 69 eMPG, but I'm getting 200+. ""EPA to investigate Ford C-Max, Fusion fuel economy"" http://t.co/6rluiW6Q",DarkSideGeek,160051128,,,,en,"San Diego, CA",,12/10/2012 7:57,-99.821927,20.6886441,6
9124,San_Diego,278087547870130176,12/10/2012 10:43,Ford Fusion,"Consumer Reports! A Phony Rag! 
http://t.co/O2AMHogd",peacemaker4u,19236097,,,,en,,"0.0, 0.0",12/10/2012 2:43,-69.6691186,-38.8233843,2
9125,San_Diego,277818422669234178,12/9/2012 16:54,Ford Fusion,Drive On: EPA reviewing Ford's gas mileage less-than-truthful claims | Is Ford anyway connected at all to ABC or CNN? http://t.co/nmuemocJ,WJGBalderama,17744717,,,,en,"San Diego, CA",,12/9/2012 8:54,-99.821927,20.6886441,6
9126,San_Diego,277775044673953792,12/9/2012 14:01,Ford Fusion,"@Ford Fusion Hybrid, C-Max Fail To Get 47 MPG As Advertised per Consumer Reports
 http://t.co/Jf33S4lE",newcarsinc,95927061,Ford,15676492,,en,"San Diego, CA",,12/9/2012 6:01,-99.821927,20.6886441,6
9127,San_Diego,277238666823335937,12/8/2012 2:30,Ford Fusion,"RT @mercnews EPA to review fuel-economy data for Ford Fusion, C-Max hybrids http://t.co/05dwlPqi via http://t.co/9w2xmskb",JeanPierreCA,614819781,,,,en,"San Diego, CA",,12/7/2012 18:30,-99.821927,20.6886441,6
9128,San_Diego,276817234712739841,12/6/2012 22:35,Ford Fusion,"Tests Show Ford Fusion, C-Max Hybrid Are Not Getting Close To 47 MPG http://t.co/cVkX9EIa",AEC4N6,110444269,,,,en,"San Diego, CA",,12/6/2012 14:35,-99.821927,20.6886441,6
9129,San_Diego,276772163216887808,12/6/2012 19:36,Ford Fusion,Did you know the all new Fusion can park itself and can detect unwanted lane changes? This is awesome!... http://t.co/KxcYGvfZ,SDCountyFord,126455124,,,,en,"San Diego, CA",,12/6/2012 11:36,-99.821927,20.6886441,6
9130,San_Diego,276771698597036032,12/6/2012 19:34,Ford Fusion,Did you know the all new Fusion can park itself and can detect unwanted lane changes? This is awesome!... http://t.co/CExd5Ll8,SDCountyFord,126455124,,,,en,"San Diego, CA",,12/6/2012 11:34,-99.821927,20.6886441,6
9131,San_Diego,276345213084106754,12/5/2012 15:20,Ford Fusion,"This Saturday on the cover of Wheels: Automotive Alchemy - the Ford Fusion.

http://t.co/3AflKtqx http://t.co/gtdqc0F0",MaynardsGarage,175166763,,,,en,"San Diego, Calif.",,12/5/2012 7:20,-99.821927,20.6886441,6
9132,San_Diego,276038025128058880,12/4/2012 18:59,Ford Fusion,"RT @Mossy_Ford: Who loves the new Fusion?
http://t.co/gNhfjHPd",MisterMossy,206770228,,,,en,Pacific Beach,,12/4/2012 10:59,-117.2382163,32.806374,4
9133,San_Diego,276037867669688320,12/4/2012 18:58,Ford Fusion,"Who loves the new Fusion?
http://t.co/gNhfjHPd",Mossy_Ford,97778357,,,,en,San Diego,,12/4/2012 10:58,-99.821927,20.6886441,6
9134,San_Diego,275955283296133120,12/4/2012 13:30,Ford Fusion,All Eyez on Ford: Tupac Shakur poetry used to market Fusion http://t.co/XWLArttV,pamarieann,69608969,,,,en,"San Diego, California",,12/4/2012 5:30,-99.821927,20.6886441,6
9135,San_Diego,275955282654420994,12/4/2012 13:30,Ford Fusion,All Eyez on Ford: Tupac Shakur poetry used to market Fusion http://t.co/qSynUhk4,msmarieaquino,91141463,,,,en,"San Diego, CA",,12/4/2012 5:30,-99.821927,20.6886441,6
9136,San_Diego,275955281748447233,12/4/2012 13:30,Ford Fusion,All Eyez on Ford: Tupac Shakur poetry used to market Fusion http://t.co/OBkP2JzO,mrmarkaquino,104620296,,,,en,"San Diego, CA",,12/4/2012 5:30,-99.821927,20.6886441,6
9920,Dallas,276770813766664192,12/6/2012 19:31,Ford Fusion,"Tests show Ford Fusion, C-Max hybrids don't live up to 47-mpg claims: Ford has been making some eye-opening clai... http://t.co/5zKA280U",OpenRoadLending,110522630,,,,en,"Irving, TX",,12/6/2012 13:31,-96.9488945,32.8140177,4
9921,Dallas,278568579396415489,12/11/2012 18:34,Ford Fusion,"Official: Ford details how it will fix recalled fire-risk 2013 Escape and Fusion models: Filed under: Sedan, Gov... http://t.co/ISTShdSd",wwCannonTX,224679747,,,,en,"Dallas, TX",,12/11/2012 12:34,-96.8004511,32.7801399,4
9922,Dallas,278532688711925761,12/11/2012 16:12,Ford Fusion,2013 Ford Fusion: The Car Connections Best Car To Buy 2013: The Fusion earned the highest rating of... http://t.co/65GclGzM #dallas #news,DallasTX_News,381533090,,,,en,"Dallas, TX",,12/11/2012 10:12,-96.8004511,32.7801399,4
9923,Dallas,278523520777060353,12/11/2012 15:35,Ford Fusion,"Ford blames software glitch for Fusion, Escape recall http://t.co/rapElPg6 $F #Cars",CraigsCollision,118580140,,,,en,"Grapevine, TX 76051",,12/11/2012 9:35,-97.0780654,32.9342919,4
9924,Dallas,278512718225489921,12/11/2012 14:53,Ford Fusion,"gotta know the scoop Ford Escape, Fusion get software fix: Update will prevent fire in 1.6-liter EcoBoost engine... http://t.co/CmhsJlBM",PatCarSavings,41496818,,,,en,Dallas,,12/11/2012 8:53,-96.8004511,32.7801399,4
9925,Dallas,278487302672633856,12/11/2012 13:12,Ford Fusion,Ford details how it will fix recalled fire-risk 2013 Escape and Fusion models http://t.co/mRK4as0X,DPete4,44064925,,,,en,DFW Texas,,12/11/2012 7:12,-97.0406533,32.8974493,9
9926,Dallas,278485139334516736,12/11/2012 13:03,Ford Fusion,"Official: Ford details how it will fix recalled fire-risk 2013 Escape and Fusion models: Filed under: Sedan, Gov... http://t.co/8TdMz2fw",OpenRoadLending,110522630,,,,en,"Irving, TX",,12/11/2012 7:03,-96.9488945,32.8140177,4
9927,Dallas,278293973951455233,12/11/2012 0:23,Ford Fusion,"Ford Announces Fix for Fire Risk in 2013 Ford Escape, Fusion:  http://t.co/bhoEv9D4",OpenRoadLending,110522630,,,,en,"Irving, TX",,12/10/2012 18:23,-96.9488945,32.8140177,4
9928,Dallas,278268241577656321,12/10/2012 22:41,Ford Fusion,"Ford says it has fix for Escape, Fusion models with fire problem  Los Angeles Times http://t.co/QoZMyA3d",JohnHortoney,420015637,,,,en,"Dallas,Texas",,12/10/2012 16:41,-96.8004511,32.7801399,4
9929,Dallas,278261746647584768,12/10/2012 22:15,Ford Fusion,"Ford says it has software fix for Escape, Fusion engine fire issues: Ford Motor Co. said it will fix nearly 90,0... http://t.co/h4ulPWH6",DPete4,44064925,,,,en,DFW Texas,,12/10/2012 16:15,-97.0406533,32.8974493,9
9930,Dallas,278259615681093632,12/10/2012 22:07,Ford Fusion,EPA to Review Ford Fusion and C-MAX Hybrids After Consumer Reports MPG Findings: Ford has been making a lot of ... http://t.co/aKKwx0vr,OpenRoadLending,110522630,,,,en,"Irving, TX",,12/10/2012 16:07,-96.9488945,32.8140177,4
9931,Dallas,278211238712975360,12/10/2012 18:55,Ford Fusion,"Fix coming for 2013 Ford Escape, Fusion models with fire risk: Ford has announced that a corrective action has b... http://t.co/fQPRObRy",OpenRoadLending,110522630,,,,en,"Irving, TX",,12/10/2012 12:55,-96.9488945,32.8140177,4
9932,Dallas,278128949249339392,12/10/2012 13:28,Ford Fusion,"EPA to investigate Ford C-Max, Fusion fuel economy http://t.co/ZcaVkOiP",DPete4,44064925,,,,en,DFW Texas,,12/10/2012 7:28,-97.0406533,32.8974493,9
9933,Dallas,278038278609960960,12/10/2012 7:27,Ford Fusion,"Ford Fusion flying car commercial has onscreen disclaimer ""Cars cannot fly.""  God bless the lawyers.",SquirrelTweets,39558552,,,,en,"Dallas, TX, USA",,12/10/2012 1:27,-96.8004511,32.7801399,4
9934,Dallas,277923661342732290,12/9/2012 23:52,Ford Fusion,I really like the new Ford Fusion,ram_rodd,557520725,,,,en,"Dallas, Tx",,12/9/2012 17:52,-96.8004511,32.7801399,4
9935,Dallas,277890998472945665,12/9/2012 21:42,Ford Fusion,I know I'm not the only one that's tired of seeing these Ford Fusion commercials,EmmettLyons,53307724,,,,en,"Addison, Texas",,12/9/2012 15:42,-96.8291685,32.96179,4
9936,Dallas,277888911647309826,12/9/2012 21:34,Ford Fusion,The look if the new Ford Fusion is nice!,ntramm068,23267581,,,,en,"Rockwall, TX",,12/9/2012 15:34,-96.4597089,32.9312336,4
9937,Dallas,277866407276990464,12/9/2012 20:04,Ford Fusion,If I see another Ford Fusion commercial while watching this game I'm gonna SCREAM ,Simplyy_Devine,121558687,,,,en,"Grand Prairie,TX",,12/9/2012 14:04,-96.9977846,32.7459645,4
9938,Dallas,277864485027446785,12/9/2012 19:57,Ford Fusion,My brother promised me a fully ford fusion if I pick him up tonight.. Lol http://t.co/KhOU3Rqi,lance713,14183460,,,,en,"Dallas, TX",,12/9/2012 13:57,-96.8004511,32.7801399,4
9939,Dallas,277863169907630080,12/9/2012 19:51,Ford Fusion,The new ford fusion looks like an Aston Martin DB9 ,vicbode,264019790,,,,en,"Irving, Texas",,12/9/2012 13:51,-96.9488945,32.8140177,4
9940,Dallas,277786673851535360,12/9/2012 14:47,Ford Fusion,"EPA to review fuel-economy data for Ford Fusion, C-Max hybrids  http://t.co/0VERTT47",WilliamJinkins,587090820,,,,en,DFW Metroplex,,12/9/2012 8:47,-97.0406533,32.8974493,9
9941,Dallas,277455287198289920,12/8/2012 16:51,Ford Fusion,gotta know the scoop Autoweek in review: On Monday we woke to a recall involving the Ford Fusion and the Escape ... http://t.co/q0ZSXVhK,PatCarSavings,41496818,,,,en,Dallas,,12/8/2012 10:51,-96.8004511,32.7801399,4
9942,Dallas,277452088156516352,12/8/2012 16:38,Ford Fusion,"EPA will review Ford C-Max, Fusion 47 mpg claims: Washington - The Environmental Protection Agency said Saturday... http://t.co/AUw3iLFu",DPete4,44064925,,,,en,DFW Texas,,12/8/2012 10:38,-97.0406533,32.8974493,9
9943,Dallas,277149956530401281,12/7/2012 20:37,Ford Fusion,"gotta know the scoop 2013 Ford Fusion recalled for faulty headlight lens: The redesigned 2013 Ford Fusion, recal... http://t.co/TAomTJWx",PatCarSavings,41496818,,,,en,Dallas,,12/7/2012 14:37,-96.8004511,32.7801399,4
9944,Dallas,277113740296613890,12/7/2012 18:13,Ford Fusion,"Another Recall for 2013 Ford Fusion, Second in a Week's Time!: Several thousand owners of the 2013 Ford Fusion i... http://t.co/Z8u1WEfu",OpenRoadLending,110522630,,,,en,"Irving, TX",,12/7/2012 12:13,-96.9488945,32.8140177,4
9945,Dallas,277093409498488832,12/7/2012 16:53,Ford Fusion,"RT @DPete4: 2013 Ford Fusion gets second recall in a week, this time for faulty headlamps http://t.co/mnGtzix9",jan_maklak,25153770,,,,en,Canada,,12/7/2012 10:53,-106.346771,56.130366,1
9946,Dallas,277092614489137156,12/7/2012 16:50,Ford Fusion,"2013 Ford Fusion gets second recall in a week, this time for faulty headlamps http://t.co/mnGtzix9",DPete4,44064925,,,,en,DFW Texas,,12/7/2012 10:50,-97.0406533,32.8974493,9
9947,Dallas,277088480117534721,12/7/2012 16:33,Ford Fusion,"Ford Fusion 2013 Recall: 19,106 Sedans Recalled For Faulty Headlamps: Dec 7 (Reuters) - Ford Motor Co is recalli... http://t.co/rfT6Z3sv",AficionTigres,244355354,,,,en,"Dallas,TX",,12/7/2012 10:33,-96.8004511,32.7801399,4
9948,Dallas,277087732990349313,12/7/2012 16:30,Ford Fusion,"#IDK News Alert: Ford Fusion 2013 Recall: 19,106 Sedans Recalled For Faulty Headlamps http://t.co/pj4TYhim",DestituteAmeric,700075502,,,,en,Southwest,,12/7/2012 10:30,-122.3948308,47.5667695,4
9949,Dallas,277082564798328833,12/7/2012 16:10,Ford Fusion,Ford recalling new Fusion for faulty headlamps http://t.co/HujEnIyq,JohnHortoney,420015637,,,,en,"Dallas,Texas",,12/7/2012 10:10,-96.8004511,32.7801399,4
9950,Dallas,276848695549509632,12/7/2012 0:40,Ford Fusion,Consumer Reports Slams Ford for Overstating Fusion and C-MAX Hybrids 47MPG Fuel Economy http://t.co/ULKIWdkN,pwthomson,26163706,,,,en,"Dallas, Texas",,12/6/2012 18:40,-96.8004511,32.7801399,4
9951,Dallas,276812363041222657,12/6/2012 22:16,Ford Fusion,Consumer Reports Slams Ford for Overstating Fusion and C-MAX Hybrids 47MPG Fuel Economy: If you've been followin... http://t.co/c3K6Ua45,OpenRoadLending,110522630,,,,en,"Irving, TX",,12/6/2012 16:16,-96.9488945,32.8140177,4
9952,Dallas,276810309061189632,12/6/2012 22:08,Ford Fusion,"Flying Fusion: Fords New Commercial Raises the Age-Old QuestionHuh? [The Ad Section]: 
Award-winning ad man-... http://t.co/BFj0tgRh",OpenRoadLending,110522630,,,,en,"Irving, TX",,12/6/2012 16:08,-96.9488945,32.8140177,4
9953,Dallas,276805863988162560,12/6/2012 21:50,Ford Fusion,RT @RobBeaird: 47 mpg Ford Fusion Hybrid at DFW Auto Show in Fort Worth #fordtx #fordautoshows #instadfw http://t.co/QKfSmUAH,ftworthautoshow,229122006,,,,en,"Fort Worth, Texas",,12/6/2012 15:50,-97.3208496,32.725409,4
9954,Dallas,276799945321877504,12/6/2012 21:27,Ford Fusion,Ford's New Hybrids Are Falling Way Short Of Promised Fuel Economy: DETROIT (Reuters) - Ford Motor Co's C-Max and... http://t.co/HnM0qcpW,GaryGColeman,49027943,,,,en,"Dallas, Texas",,12/6/2012 15:27,-96.8004511,32.7801399,4
9955,Dallas,276799935679172609,12/6/2012 21:27,Ford Fusion,Ford's New Hybrids Are Falling Way Short Of Promised Fuel Economy http://t.co/UsZawbSo,xvaCapital,606560564,,,,en,Dallas TX,,12/6/2012 15:27,-96.8004511,32.7801399,4
9956,Dallas,276720986034929664,12/6/2012 16:13,Ford Fusion,47 mpg Ford Fusion Hybrid at DFW Auto Show in Fort Worth #fordtx #fordautoshows #instadfw http://t.co/QKfSmUAH,RobBeaird,26227982,,,,en,"Dallas, TX",,12/6/2012 10:13,-96.8004511,32.7801399,4
9957,Dallas,276390612700364800,12/5/2012 18:20,Ford Fusion,"You drive a Ford Fusion. It isn't that hard to park in the lines. 
Fucking idiot. http://t.co/jxqsFm4O",jacobchavez_,296334342,,,,en,,"32.725619, -96.901491",12/5/2012 12:20,-69.6691186,-38.8233843,2
9958,Dallas,276375515944865792,12/5/2012 17:20,Ford Fusion,"gotta know the scoop Ford Ranger T6, EcoSport crossover spied in Denver: Test fleet included Ford Fusion sedans,... http://t.co/ymIrCHjz",PatCarSavings,41496818,,,,en,Dallas,,12/5/2012 11:20,-96.8004511,32.7801399,4
11455,Houston,278574540391604225,12/11/2012 18:58,Ford Fusion,RT @shellracingus: Take a look at the new No. 22 @penskeracing Shell-Pennzoil Ford Fusion piloted by @joeylogano testing today at CMS. http://t.co/qIIlF8bv,RBBRulesBenitez,48490998,,,,en,Estado de M??xico,,12/11/2012 12:58,-99.7232673,19.4968732,2
11456,Houston,277163159226310658,12/7/2012 21:30,Ford Fusion,"2013 Ford Fusion recalled for faulty headlight lens - The redesigned 2013 Ford Fusion, recalled earlier this week fo... http://t.co/rKew35QR",pautoappraisers,439351197,,,,en,"Houston, TX",,12/7/2012 15:30,-95.3693896,29.7601927,4
11457,Houston,276310090099871745,12/5/2012 13:00,Ford Fusion,When Ford made the fusion did they try to imitate Aston Martin on the front of the car? Lmao,ABRAHAMALAVREZ,229624532,,,,en,Houston Texas ,,12/5/2012 7:00,-95.3693896,29.7601927,4
11458,Houston,277120048336867328,12/7/2012 18:39,Ford Fusion,StarWatch Consumer | Ford Fusion recall T-Mobile to sell iPhone - Kansas City Star http://t.co/XrB1Ism0,Iphonedeals,27186285,,,,en,Worldwide,,12/7/2012 12:39,-84.7227071,39.0841968,6
11459,Houston,277118754725441537,12/7/2012 18:33,Ford Fusion,"Ford recalling new Fusion for faulty headlamps - Ford plans to recall more than 19,000 of its new Fusion midsize sed... http://t.co/QSALeJIm",pautoappraisers,439351197,,,,en,"Houston, TX",,12/7/2012 12:33,-95.3693896,29.7601927,4
11460,Houston,277107908918005760,12/7/2012 17:50,Ford Fusion,RT @shellracingus: @shellracingus welcomes @joeylogano to Penske Racing and as the driver of the No. 22 Shell-Pennzoil Ford Fusion! http://t.co/N2sAtNeG,QJSparx,37789550,,,,en,"Patterson, Louisiana, America",,12/7/2012 11:50,-121.129656,37.4716001,4
11461,Houston,277096416059478017,12/7/2012 17:05,Ford Fusion,New Ford Fusion model recalled for second time in two weeks http://t.co/mIEjODOF,Newsquicki,90898077,,,,en,Worldwide,,12/7/2012 11:05,-84.7227071,39.0841968,6
11462,Houston,277092925098299392,12/7/2012 16:51,Ford Fusion,"|http://t.co/wzYwattT| 2013 Ford Fusion gets second recall in a week, this time for faulty headla... http://t.co/s4fkjbC0 #teamfollowback",analyzerxl,433223345,,,,en,Worldwide,,12/7/2012 10:51,-84.7227071,39.0841968,6
11463,Houston,277088535922745346,12/7/2012 16:33,Ford Fusion,"Ford Fusion 2013 Recall: 19,106 Sedans Recalled For Faulty Headlamps: Dec 7 (Reuters) - Ford Motor Co is recalli... http://t.co/WM4dr9Zv",CoolestGadgetsz,612439176,,,,en,Houston,,12/7/2012 10:33,-95.3693896,29.7601927,4
11464,Houston,277088501495914496,12/7/2012 16:33,Ford Fusion,"Ford Fusion 2013 Recall: 19,106 Sedans Recalled For Faulty Headlamps http://t.co/DH95ttOU",Obsessed_W_News,742016113,,,,en,WORLDWIDE,,12/7/2012 10:33,-84.7227071,39.0841968,6
11465,Houston,277053594572836865,12/7/2012 14:14,Ford Fusion,RT @shellracingus: @shellracingus welcomes @joeylogano to Penske Racing and as the driver of the No. 22 Shell-Pennzoil Ford Fusion! http://t.co/N2sAtNeG,jmusicman1,121947752,,,,en,"Mesa, Arizona",,12/7/2012 8:14,-111.8314724,33.4151843,4
11466,Houston,277051670247133184,12/7/2012 14:07,Ford Fusion,Ford recalls Fusion to fix faulty headlights http://t.co/G07mQk3d,BreakingFlash,395090674,,,,en,Worldwide,,12/7/2012 8:07,-84.7227071,39.0841968,6
11467,Houston,277034738496204800,12/7/2012 13:00,Ford Fusion,RT @shellracingus: @shellracingus welcomes @joeylogano to Penske Racing and as the driver of the No. 22 Shell-Pennzoil Ford Fusion! http://t.co/N2sAtNeG,Wendi_Lee1,167187934,,,,en,"Long Lake, Barrington NH",,12/7/2012 7:00,-97.2271437,37.6605904,6
11468,Houston,276884930749935618,12/7/2012 3:04,Ford Fusion,Ford fusion looks like an Aston Martin from the front,ThatNiggaChrix,318154623,,,,en,City of the Purple Sprite,,12/6/2012 21:04,0,0,0
11469,Houston,276884800781041664,12/7/2012 3:04,Ford Fusion,Consumer Reports road testing finds Ford Fusion and C-MAX hybrids falling far short of EPA ratings http://t.co/a99TRR8X,ev_newscast,266399336,,,,en,Bay Area,,12/6/2012 21:04,-122.25,37.7141454,3
11470,Houston,276867098322546688,12/7/2012 1:53,Ford Fusion,Bitch that new Ford Fusion &gt&gt&gt,IamMrFancy,32774202,,,,en, Houston,,12/6/2012 19:53,-95.3693896,29.7601927,4
11471,Houston,276813103461699586,12/6/2012 22:19,Ford Fusion,"Video: Consumer Reports calls out Ford for false Fusion, C-Max hybrid fuel economy claims http://t.co/2eVuS4Ny",ev_newscast,266399336,,,,en,Bay Area,,12/6/2012 16:19,-122.25,37.7141454,3
11472,Houston,276810324592697344,12/6/2012 22:08,Ford Fusion,"Flying Fusion: Fords New Commercial Raises the Age-Old QuestionHuh? [The Ad Section]: 
Award-winning ad man-... http://t.co/O761QCpn",HoustonCarCare,538420553,,,,en,Houston,,12/6/2012 16:08,-95.3693896,29.7601927,4
11473,Houston,276801588763435008,12/6/2012 21:33,Ford Fusion,"|http://t.co/wzYwattT| Video: Consumer Reports calls out Ford for false Fusion, C-Max hybrid fuel... http://t.co/WWTJSd13 #teamfollowback",analyzerxl,433223345,,,,en,Worldwide,,12/6/2012 15:33,-84.7227071,39.0841968,6
11474,Houston,276792898358493185,12/6/2012 20:59,Ford Fusion,Ford hybrids fall short of fuel claims-Consumer Reports: DETROIT (Reuters) - Ford Motor Co's  C-Max and Fusion h... http://t.co/mbLznIl7,DividendGenius,19203885,,,,en,"Houston, Texas",,12/6/2012 14:59,-95.3693896,29.7601927,4
11475,Houston,276784468054925312,12/6/2012 20:25,Ford Fusion,"Consumer Reports says Ford Fusion, C-Max don't achieve MPG claims http://t.co/1lG5sPoC",Newsquicki,90898077,,,,en,Worldwide,,12/6/2012 14:25,-84.7227071,39.0841968,6
11476,Houston,276778052166496257,12/6/2012 20:00,Ford Fusion,How Houston Can Go Green in the All-New Ford Fusion Energi http://t.co/pdACm9FV,accollinsford,109085183,,,,en,,"29.644636, -95.15805",12/6/2012 14:00,-69.6691186,-38.8233843,2
11477,Houston,276767876784979969,12/6/2012 19:19,Ford Fusion,"#IKEA Tests show Ford Fusion, C-Max hybrids don't live up to 47-mpg claims: 
     

Tests show Ford Fusi... http://t.co/QgcdW5vi",ikeasucks,306013161,,,,en,Worldwide,,12/6/2012 13:19,-84.7227071,39.0841968,6
11478,Houston,276766143044268032,12/6/2012 19:12,Ford Fusion,@FordService I have a 2007 ford fusion got to love it too,FalconAb88,923979938,FordService,16512432,276714864406298624,en,Houston Texas,,12/6/2012 13:12,-95.3693896,29.7601927,4
11479,Houston,276735259943518208,12/6/2012 17:10,Ford Fusion,#In2013YouBetterNot Share this #Ford Fusion. #ThinkAuto http://t.co/HopXr0IK #Philadelphia #PA #cars,ooyyonetwork,60863148,,,,en,Worldwide,,12/6/2012 11:10,-84.7227071,39.0841968,6
